{
  "manifest_version": 2,
  "kind": "policy-attestation",
  "generator": {
    "name": "modonome",
    "homepage": "https://modonome.com",
    "repository": "https://github.com/enumind/modonome"
  },
  "disclosure": {
    "model": "architectural",
    "statement": "AI participation in this repository is disclosed at the architectural level rather than per artifact. Trust rests on the governance process: CI gates, an independent checker, and the anti-gaming ratchet. Git history reflects human ownership, and agent identity stays out of commit messages, branch names, and pull requests.",
    "sources": [
      {
        "file": "README.md",
        "section": "Development practice",
        "found": true,
        "sha256": "sha256:a19f2bf634e8ca46d8143daecac418cbccf5d9ba555dee40f448a2ec97e36a34"
      },
      {
        "file": "AGENTS.md",
        "section": "Commit messages",
        "found": false,
        "sha256": null
      }
    ]
  },
  "policy": {
    "attribution_sources": [
      {
        "file": "scripts/lib/branch-name.mjs",
        "sha256": "sha256:39eb059a2ae2d05ffea008a764c8ee54d4512f392d93c49cba0d1d0df7a26e78"
      },
      {
        "file": "scripts/lib/commit-identity.mjs",
        "sha256": "sha256:cac7448be7d7d4dd22883cdcf78a7f351b926cd087505967814a1c2ff5dee2be"
      },
      {
        "file": "scripts/lib/detect-attribution.mjs",
        "sha256": "sha256:ccc5c76cd7b844283a20f6e510b6aae9bf403f654cbb16bf1e632162e722a085"
      },
      {
        "file": "scripts/lib/near-miss.mjs",
        "sha256": "sha256:4f7779cf5392e036bb31212825c280df1825f69daaceeba4812ea39ed04d0882"
      }
    ],
    "branch_denylist": [
      "ai",
      "anthropic",
      "bot",
      "claude",
      "copilot",
      "gemini",
      "gpt",
      "llm",
      "openai"
    ],
    "capabilities": [
      {
        "name": "repo_network_enabled",
        "default": false
      },
      {
        "name": "market_scan_enabled",
        "default": false
      },
      {
        "name": "envisioner_enabled",
        "default": false
      },
      {
        "name": "remediation_apply_enabled",
        "default": false
      }
    ],
    "protected_paths_extra": [
      ".github",
      "bin",
      "prompts",
      "schemas",
      "scripts",
      "site",
      "templates"
    ],
    "gates": [
      "agentproof",
      "check-agentproof-registry",
      "check-architecture-drift",
      "check-attribution-fp-corpus",
      "check-checker-engagement",
      "check-control-panel-coherence",
      "check-control-panel-coverage",
      "check-decisions-authority",
      "check-drift",
      "check-gate-dag",
      "check-learning-traceability",
      "check-md-governance",
      "check-message-catalog-integrity",
      "check-promotion-readiness",
      "check-regex-safety",
      "check-repo-hygiene",
      "check-risk-surface-allowlist",
      "check-self-application",
      "check-style",
      "check-work-item-staleness",
      "check-work-items",
      "policy-attestation-freshness",
      "snapshot-freshness",
      "tests"
    ]
  },
  "posture": {
    "autonomy_enabled": false,
    "dry_run": true
  },
  "content_digest": "sha256:6ba3670ed541353a52d70a0fb7f645dc1dd1c4d0da9d7c7dfa7fec232936a299"
}
